{
  "absolute_local_paths_persisted": false,
  "artifact_hash": "b51ec23dd4bad9ed66d7036ec209f6841f99d1e38b0b7766afd16ff75f9004d7",
  "artifact_type": "task039d1_data_access_audit_v1",
  "attacks_accessed": false,
  "authorized_files": [
    "hai-23.05/hai-train1.csv",
    "hai-23.05/hai-train2.csv"
  ],
  "br2_pair_results_accessed": false,
  "candidate_arm_evidence_visible_during_profiling": false,
  "dataset_manifest_id": "5b0c395169fea468f7afd52aceafc4e6dadf062a1bc557c5bbe5dd6b8a761aa2",
  "event_timestamps_publicly_persisted": false,
  "feature_read_pass_count": 2,
  "file_open_count": 4,
  "file_records": [
    {
      "byte_size": 162418984,
      "file_identity_match": true,
      "header_identity_match": true,
      "header_sha256": "95968d825d1c9caab778a857cec618b64674ec5a85d94e6952d99c2cab08d16a",
      "relative_path": "hai-23.05/hai-train1.csv",
      "row_count": 280800,
      "sha256": "53007b0ba604fbf338e7ac2e08cd81d874b5d1388f3aecb213ddcba5bf2bec4a"
    },
    {
      "byte_size": 169121615,
      "file_identity_match": true,
      "header_identity_match": true,
      "header_sha256": "95968d825d1c9caab778a857cec618b64674ec5a85d94e6952d99c2cab08d16a",
      "relative_path": "hai-23.05/hai-train2.csv",
      "row_count": 291600,
      "sha256": "0e520e82bf78a661ab19ce4967f3c766bd809820f457a9c90c365102d4534c56"
    }
  ],
  "labels_accessed": false,
  "p2_p3_p4_values_accessed": false,
  "process": "P1",
  "prohibited_access_count": 0,
  "raw_values_persisted": false,
  "raw_windows_persisted": false,
  "schema_version": "1.0.0",
  "selected_column_count": 24,
  "selected_column_hash": "db0e2ee040ebccacd54e6030b12d2be0dcb431cedacf2f24a3e1bff38de34a4b",
  "status": "passed_task039d1_data_boundary",
  "task_id": "TASK-039D1",
  "test_accessed": false,
  "timestamp_header_structural_verification_only": true,
  "timestamp_values_persisted": false,
  "train1_accessed": true,
  "train2_accessed": true,
  "train3_accessed": false,
  "train4_accessed": false
}
